{
  "version": 2,
  "name": "feature6",
  "label": "Feature 6",
  "type": "feature",
  "preview": "img/components/feature-6.png",
  "block": {
    "id": "b79UkJ0X",
    "label": "Feature 6",
    "settings": {
      "spacing": {
        "padding": [
          34,
          32,
          34,
          32
        ]
      },
      "backgroundColor": "#FFF9F3"
    },
    "rows": [
      {
        "id": "U-hxCv-t",
        "settings": {
          "spacing": {},
          "backgroundColor": "transparent",
          "hiddenOnMobile": false,
          "collapseOnMobile": true,
          "gap": 0
        },
        "cells": [
          {
            "id": "2FOCjGBm",
            "settings": {
              "spacing": {},
              "backgroundColor": "transparent",
              "verticalAlign": "top",
              "horizontalAlign": "left"
            },
            "atoms": [
              {
                "id": "XtwCHrMd",
                "type": "text",
                "value": "<div style=\"color:#1F1712\"><p><strong><span style=\"color:#FF6B00;font-size:13px\">CAPABILITY MAP</span></strong></p><p><strong><span style=\"font-size:31px\">Four parts, one editing model.</span></strong></p></div>",
                "spacing": {
                  "padding": [
                    0,
                    0,
                    0,
                    0
                  ],
                  "margin": [
                    0,
                    0,
                    0,
                    0
                  ]
                }
              }
            ],
            "rows": []
          }
        ]
      },
      {
        "id": "82zg_6Lo",
        "settings": {
          "spacing": {
            "padding": [
              18,
              0,
              0,
              0
            ]
          },
          "backgroundColor": "transparent",
          "hiddenOnMobile": false,
          "collapseOnMobile": true,
          "gap": 16
        },
        "cells": [
          {
            "id": "RHGII4l6",
            "settings": {
              "spacing": {
                "padding": [
                  20,
                  18,
                  20,
                  18
                ]
              },
              "backgroundColor": "#FFF3E6",
              "verticalAlign": "top",
              "horizontalAlign": "left",
              "borderRadius": 16,
              "width": 50
            },
            "atoms": [
              {
                "id": "MWIwIzdG",
                "type": "text",
                "value": "<div style=\"color:#1F1712\"><p><strong><span style=\"color:#FF6B00;font-size:12px\">COMPOSE</span></strong></p><p><strong><span style=\"font-size:21px\">Reusable block library</span></strong></p><p><span style=\"color:#7A6558;font-size:13px\">Start from a useful position rather than a completed campaign.</span></p></div>",
                "spacing": {
                  "padding": [
                    0,
                    0,
                    0,
                    0
                  ],
                  "margin": [
                    0,
                    0,
                    0,
                    0
                  ]
                }
              }
            ],
            "rows": []
          },
          {
            "id": "uVIj88Mv",
            "settings": {
              "spacing": {
                "padding": [
                  20,
                  18,
                  20,
                  18
                ]
              },
              "backgroundColor": "#FFD9B8",
              "verticalAlign": "top",
              "horizontalAlign": "left",
              "borderRadius": 16,
              "width": 50
            },
            "atoms": [
              {
                "id": "HpBN9vJV",
                "type": "text",
                "value": "<div style=\"color:#1F1712\"><p><strong><span style=\"color:#5A2B0A;font-size:12px\">REFINE</span></strong></p><p><strong><span style=\"font-size:21px\">Explicit content tree</span></strong></p><p><span style=\"color:#5A2B0A;font-size:13px\">Move from block to atom without losing the surrounding structure.</span></p></div>",
                "spacing": {
                  "padding": [
                    0,
                    0,
                    0,
                    0
                  ],
                  "margin": [
                    0,
                    0,
                    0,
                    0
                  ]
                }
              }
            ],
            "rows": []
          }
        ]
      },
      {
        "id": "ynlsycj1",
        "settings": {
          "spacing": {
            "padding": [
              16,
              0,
              0,
              0
            ]
          },
          "backgroundColor": "transparent",
          "hiddenOnMobile": false,
          "collapseOnMobile": true,
          "gap": 16
        },
        "cells": [
          {
            "id": "k92EnpCz",
            "settings": {
              "spacing": {
                "padding": [
                  20,
                  18,
                  20,
                  18
                ]
              },
              "backgroundColor": "#FFD9B8",
              "verticalAlign": "top",
              "horizontalAlign": "left",
              "borderRadius": 16,
              "width": 50
            },
            "atoms": [
              {
                "id": "AGjqRs6M",
                "type": "text",
                "value": "<div style=\"color:#1F1712\"><p><strong><span style=\"color:#5A2B0A;font-size:12px\">REVIEW</span></strong></p><p><strong><span style=\"font-size:21px\">Desktop and mobile preview</span></strong></p><p><span style=\"color:#5A2B0A;font-size:13px\">Check hierarchy and stacking before the message leaves the editor.</span></p></div>",
                "spacing": {
                  "padding": [
                    0,
                    0,
                    0,
                    0
                  ],
                  "margin": [
                    0,
                    0,
                    0,
                    0
                  ]
                }
              }
            ],
            "rows": []
          },
          {
            "id": "a9XFijt6",
            "settings": {
              "spacing": {
                "padding": [
                  20,
                  18,
                  20,
                  18
                ]
              },
              "backgroundColor": "#FFF3E6",
              "verticalAlign": "top",
              "horizontalAlign": "left",
              "borderRadius": 16,
              "width": 50
            },
            "atoms": [
              {
                "id": "AThJ6Cr_",
                "type": "text",
                "value": "<div style=\"color:#1F1712\"><p><strong><span style=\"color:#FF6B00;font-size:12px\">DELIVER</span></strong></p><p><strong><span style=\"font-size:21px\">JSON and HTML output</span></strong></p><p><span style=\"color:#7A6558;font-size:13px\">Keep the versioned source and the email-ready result connected.</span></p></div>",
                "spacing": {
                  "padding": [
                    0,
                    0,
                    0,
                    0
                  ],
                  "margin": [
                    0,
                    0,
                    0,
                    0
                  ]
                }
              }
            ],
            "rows": []
          }
        ]
      }
    ]
  }
}
