{
  "version": 2,
  "name": "feature4",
  "label": "Feature 4",
  "type": "feature",
  "preview": "img/components/feature-4.png",
  "block": {
    "id": "WZEhqA9T",
    "label": "Feature 4",
    "settings": {
      "spacing": {
        "padding": [
          34,
          32,
          34,
          32
        ]
      },
      "backgroundColor": "#FFF9F3"
    },
    "rows": [
      {
        "id": "2-pNbsM8",
        "settings": {
          "spacing": {},
          "backgroundColor": "transparent",
          "hiddenOnMobile": false,
          "collapseOnMobile": true,
          "gap": 20
        },
        "cells": [
          {
            "id": "mApIYfyD",
            "settings": {
              "spacing": {
                "padding": [
                  10,
                  12,
                  10,
                  0
                ]
              },
              "backgroundColor": "transparent",
              "verticalAlign": "middle",
              "horizontalAlign": "left",
              "width": 62
            },
            "atoms": [
              {
                "id": "af-jXkbc",
                "type": "text",
                "value": "<div style=\"color:#1F1712\"><p><strong><span style=\"color:#FF6B00;font-size:13px\">GUIDED BY THE MESSAGE</span></strong></p><p><strong><span style=\"font-size:31px\">Three rules the editor keeps visible.</span></strong></p></div>",
                "spacing": {
                  "padding": [
                    0,
                    0,
                    0,
                    0
                  ],
                  "margin": [
                    0,
                    0,
                    0,
                    0
                  ]
                }
              },
              {
                "id": "zNC1Guet",
                "type": "divider",
                "color": "#FFD9B8",
                "height": 1,
                "spacing": {
                  "padding": [
                    0,
                    0,
                    0,
                    0
                  ],
                  "margin": [
                    16,
                    0,
                    16,
                    0
                  ]
                }
              },
              {
                "id": "upvtlwC-",
                "type": "text",
                "value": "<div style=\"color:#1F1712\"><p><strong><span style=\"font-size:19px\">Hierarchy stays explicit</span></strong><br /><span style=\"color:#7A6558;font-size:13px\">The selected block, row, cell and atom remain understandable.</span></p></div>",
                "spacing": {
                  "padding": [
                    0,
                    0,
                    0,
                    0
                  ],
                  "margin": [
                    0,
                    0,
                    0,
                    0
                  ]
                }
              },
              {
                "id": "kAEgnww6",
                "type": "divider",
                "color": "#FFD9B8",
                "height": 1,
                "spacing": {
                  "padding": [
                    0,
                    0,
                    0,
                    0
                  ],
                  "margin": [
                    16,
                    0,
                    16,
                    0
                  ]
                }
              },
              {
                "id": "GjvwIYa6",
                "type": "text",
                "value": "<div style=\"color:#1F1712\"><p><strong><span style=\"font-size:19px\">Changes stay local</span></strong><br /><span style=\"color:#7A6558;font-size:13px\">Edit the useful layer without rebuilding the surrounding email.</span></p></div>",
                "spacing": {
                  "padding": [
                    0,
                    0,
                    0,
                    0
                  ],
                  "margin": [
                    0,
                    0,
                    0,
                    0
                  ]
                }
              },
              {
                "id": "42L7UyhD",
                "type": "divider",
                "color": "#FFD9B8",
                "height": 1,
                "spacing": {
                  "padding": [
                    0,
                    0,
                    0,
                    0
                  ],
                  "margin": [
                    16,
                    0,
                    16,
                    0
                  ]
                }
              },
              {
                "id": "O0qkaElV",
                "type": "text",
                "value": "<div style=\"color:#1F1712\"><p><strong><span style=\"font-size:19px\">Output stays predictable</span></strong><br /><span style=\"color:#7A6558;font-size:13px\">The reviewed structure is the structure that gets exported.</span></p></div>",
                "spacing": {
                  "padding": [
                    0,
                    0,
                    0,
                    0
                  ],
                  "margin": [
                    0,
                    0,
                    0,
                    0
                  ]
                }
              }
            ],
            "rows": []
          },
          {
            "id": "pdW0aJQi",
            "settings": {
              "spacing": {
                "padding": [
                  20,
                  8,
                  0,
                  8
                ]
              },
              "backgroundColor": "#FF6B00",
              "verticalAlign": "bottom",
              "horizontalAlign": "center",
              "borderRadius": 18,
              "width": 38
            },
            "atoms": [
              {
                "id": "JXfTAJYI",
                "type": "image",
                "src": "img/catalog/presenters/skincare-presenter.png",
                "link": "https://card.email/features",
                "alt": "Presenter indicating a set of product capabilities",
                "width": 245,
                "spacing": {
                  "padding": [
                    0,
                    0,
                    0,
                    0
                  ],
                  "margin": [
                    0,
                    0,
                    0,
                    0
                  ]
                }
              }
            ],
            "rows": []
          }
        ]
      }
    ]
  }
}
