{
  "version": 2,
  "name": "footer2-dark",
  "label": "Footer 2",
  "type": "footer",
  "preview": "img/components/footer-2-dark.png",
  "block": {
    "id": "Hkdx4ySm",
    "label": "Footer 2",
    "settings": {
      "spacing": {
        "padding": [
          30,
          35,
          30,
          35
        ]
      },
      "backgroundColor": "#222222"
    },
    "rows": [
      {
        "id": "TyaYiJM5",
        "settings": {
          "spacing": {
            "padding": [
              0,
              0,
              25,
              0
            ]
          },
          "backgroundColor": "transparent",
          "gap": 0,
          "collapseOnMobile": true
        },
        "cells": [
          {
            "id": "1EzePIwO",
            "settings": {
              "spacing": {},
              "backgroundColor": "transparent",
              "verticalAlign": "top",
              "horizontalAlign": "center"
            },
            "atoms": [
              {
                "id": "bBEW7SlM",
                "type": "menu",
                "itemType": "image",
                "gap": 20,
                "items": [
                  {
                    "type": "image",
                    "name": "Facebook",
                    "link": "https://example.com",
                    "url": "img/system/social/footer/footer-facebook-white.png",
                    "width": 16,
                    "alt": "Facebook"
                  },
                  {
                    "type": "image",
                    "name": "Twitter",
                    "link": "https://example.com",
                    "url": "img/system/social/menu/twitter-x-white.png",
                    "width": 16,
                    "alt": "Twitter"
                  },
                  {
                    "type": "image",
                    "name": "Instagram",
                    "link": "https://example.com",
                    "url": "img/system/social/footer/footer-instagram-white.png",
                    "width": 16,
                    "alt": "Instagram"
                  }
                ],
                "spacing": {
                  "margin": [
                    0,
                    0,
                    0,
                    0
                  ],
                  "padding": [
                    0,
                    0,
                    0,
                    0
                  ]
                }
              }
            ],
            "rows": []
          }
        ]
      },
      {
        "id": "PrPnm4eO",
        "settings": {
          "spacing": {},
          "backgroundColor": "transparent",
          "gap": 0,
          "collapseOnMobile": true
        },
        "cells": [
          {
            "id": "5pbABSfc",
            "settings": {
              "spacing": {},
              "backgroundColor": "transparent",
              "verticalAlign": "top",
              "horizontalAlign": "left",
              "width": 21
            },
            "atoms": [
              {
                "id": "o6dvm6r_",
                "type": "image",
                "src": "img/system/logos/logo-white.png",
                "link": "https://example.com",
                "alt": "MySigMail",
                "width": 110,
                "spacing": {
                  "margin": [
                    0,
                    0,
                    0,
                    0
                  ],
                  "padding": [
                    0,
                    0,
                    0,
                    0
                  ]
                }
              }
            ],
            "rows": []
          },
          {
            "id": "pl_hzwwV",
            "settings": {
              "spacing": {
                "padding": [
                  0,
                  0,
                  0,
                  30
                ]
              },
              "backgroundColor": "transparent",
              "verticalAlign": "top",
              "horizontalAlign": "left",
              "width": 79
            },
            "atoms": [
              {
                "id": "VZ179NCb",
                "type": "text",
                "value": "<div style=\"color:#AAAAAA\"><p><span style=\"font-size:14px;color:rgb(170, 170, 170)\">500 Howard Street San Francisco, CA 94105<br /><u><a href=\"https://example.com\" style=\"color:rgb(170, 170, 170)\">hello@example.com</a></u></span></p></div>",
                "spacing": {
                  "margin": [
                    0,
                    0,
                    0,
                    0
                  ],
                  "padding": [
                    0,
                    0,
                    0,
                    0
                  ]
                }
              },
              {
                "id": "eDCSkkbh",
                "type": "menu",
                "itemType": "text",
                "gap": 20,
                "items": [
                  {
                    "type": "text",
                    "text": "Update preferences",
                    "link": "https://example.com",
                    "color": "#FFFFFF",
                    "fontSize": 14
                  },
                  {
                    "type": "text",
                    "text": "Unsubscribe",
                    "link": "https://example.com",
                    "color": "#FFFFFF",
                    "fontSize": 14
                  },
                  {
                    "type": "text",
                    "text": "Policies",
                    "link": "https://example.com",
                    "color": "#FFFFFF",
                    "fontSize": 14
                  }
                ],
                "spacing": {
                  "margin": [
                    0,
                    0,
                    0,
                    0
                  ],
                  "padding": [
                    2,
                    0,
                    0,
                    0
                  ]
                }
              }
            ],
            "rows": []
          }
        ]
      }
    ]
  }
}
