{
  "version": 2,
  "name": "menu2-light",
  "label": "Menu 6",
  "type": "menu",
  "preview": "img/components/menu-2-light.png",
  "block": {
    "id": "1XXB6dUF",
    "label": "Menu 6",
    "settings": {
      "spacing": {
        "padding": [
          30,
          24,
          30,
          24
        ]
      },
      "backgroundColor": "#FFFFFF"
    },
    "rows": [
      {
        "id": "7PAkjT77",
        "settings": {
          "spacing": {},
          "backgroundColor": "transparent",
          "gap": 0,
          "collapseOnMobile": false
        },
        "cells": [
          {
            "id": "7Kl_neYb",
            "settings": {
              "spacing": {},
              "backgroundColor": "transparent",
              "verticalAlign": "top",
              "horizontalAlign": "center"
            },
            "atoms": [
              {
                "id": "tdZNb30u",
                "type": "image",
                "src": "img/system/logos/logo-black.png",
                "link": "https://example.com",
                "alt": "Some alt",
                "width": 110,
                "spacing": {
                  "margin": [
                    0,
                    0,
                    0,
                    0
                  ],
                  "padding": [
                    0,
                    0,
                    0,
                    0
                  ]
                }
              },
              {
                "id": "ngLLryUx",
                "type": "divider",
                "color": "#444444",
                "height": 1,
                "spacing": {
                  "margin": [
                    0,
                    0,
                    0,
                    0
                  ],
                  "padding": [
                    10,
                    0,
                    10,
                    0
                  ]
                }
              },
              {
                "id": "8x3yM58F",
                "type": "menu",
                "itemType": "text",
                "gap": 10,
                "items": [
                  {
                    "type": "text",
                    "text": "Specs",
                    "link": "https://example",
                    "color": "#222222",
                    "fontSize": 16
                  },
                  {
                    "type": "text",
                    "text": "Feature",
                    "link": "https://example",
                    "color": "#222222",
                    "fontSize": 16
                  },
                  {
                    "type": "text",
                    "text": "Price",
                    "link": "https://example",
                    "color": "#222222",
                    "fontSize": 16
                  }
                ],
                "spacing": {
                  "margin": [
                    0,
                    0,
                    0,
                    0
                  ],
                  "padding": [
                    0,
                    0,
                    0,
                    0
                  ]
                }
              }
            ],
            "rows": []
          }
        ]
      }
    ]
  }
}
