{
  "version": 2,
  "name": "content1",
  "label": "Content 1",
  "type": "content",
  "preview": "img/components/content-1.png",
  "block": {
    "id": "lIQcolOZ",
    "label": "Content 1",
    "settings": {
      "spacing": {
        "padding": [
          44,
          44,
          40,
          44
        ]
      },
      "backgroundColor": "#FFF9F3"
    },
    "rows": [
      {
        "id": "ZpCshJt0",
        "settings": {
          "spacing": {},
          "backgroundColor": "transparent",
          "hiddenOnMobile": false,
          "collapseOnMobile": true,
          "gap": 0
        },
        "cells": [
          {
            "id": "h6CJDQ5x",
            "settings": {
              "spacing": {},
              "backgroundColor": "transparent",
              "verticalAlign": "top",
              "horizontalAlign": "left"
            },
            "atoms": [
              {
                "id": "h7acjiWh",
                "type": "text",
                "value": "<div style=\"color:#1F1712\"><p><strong><span style=\"color:#FF6B00;font-size:13px\">EDITOR'S NOTE / 01</span></strong></p><p><strong><span style=\"font-size:38px\">The useful part starts before the big idea.</span></strong></p><p><span style=\"color:#7A6558;font-size:17px\">A text-first opening for a point of view, announcement or thoughtful introduction.</span></p></div>",
                "spacing": {
                  "padding": [
                    0,
                    0,
                    0,
                    0
                  ],
                  "margin": [
                    0,
                    0,
                    0,
                    0
                  ]
                }
              },
              {
                "id": "SXzqGnaq",
                "type": "divider",
                "color": "#FFD9B8",
                "height": 1,
                "spacing": {
                  "padding": [
                    0,
                    0,
                    0,
                    0
                  ],
                  "margin": [
                    18,
                    0,
                    18,
                    0
                  ]
                }
              }
            ],
            "rows": []
          }
        ]
      },
      {
        "id": "GPNQ8JtY",
        "settings": {
          "spacing": {},
          "backgroundColor": "transparent",
          "hiddenOnMobile": false,
          "collapseOnMobile": true,
          "gap": 28
        },
        "cells": [
          {
            "id": "h37960CJ",
            "settings": {
              "spacing": {},
              "backgroundColor": "transparent",
              "verticalAlign": "top",
              "horizontalAlign": "left",
              "width": 50
            },
            "atoms": [
              {
                "id": "F__w2E_S",
                "type": "text",
                "value": "<div style=\"color:#1F1712\"><p><strong><span style=\"font-size:16px\">Start with context</span></strong></p><p><span style=\"color:#7A6558;font-size:14px\">Explain what changed and why the reader should care now.</span></p></div>",
                "spacing": {
                  "padding": [
                    0,
                    0,
                    0,
                    0
                  ],
                  "margin": [
                    0,
                    0,
                    0,
                    0
                  ]
                }
              }
            ],
            "rows": []
          },
          {
            "id": "-T6-tRyr",
            "settings": {
              "spacing": {},
              "backgroundColor": "transparent",
              "verticalAlign": "top",
              "horizontalAlign": "left",
              "width": 50
            },
            "atoms": [
              {
                "id": "9QyWJNb_",
                "type": "text",
                "value": "<div style=\"color:#1F1712\"><p><strong><span style=\"font-size:16px\">End with direction</span></strong></p><p><span style=\"color:#7A6558;font-size:14px\">Give the next section a clear promise instead of another headline.</span></p></div>",
                "spacing": {
                  "padding": [
                    0,
                    0,
                    0,
                    0
                  ],
                  "margin": [
                    0,
                    0,
                    0,
                    0
                  ]
                }
              }
            ],
            "rows": []
          }
        ]
      }
    ]
  }
}
