{
  "version": 2,
  "name": "menu1-dark",
  "label": "Menu 1",
  "type": "menu",
  "preview": "img/components/menu-1-dark.png",
  "block": {
    "id": "rt373vVg",
    "label": "Menu 1",
    "settings": {
      "spacing": {
        "padding": [
          30,
          24,
          30,
          24
        ]
      },
      "backgroundColor": "#222222"
    },
    "rows": [
      {
        "id": "SFuNyeT4",
        "settings": {
          "spacing": {},
          "backgroundColor": "transparent",
          "gap": 0,
          "collapseOnMobile": false
        },
        "cells": [
          {
            "id": "30CoAbKD",
            "settings": {
              "spacing": {},
              "backgroundColor": "transparent",
              "verticalAlign": "middle",
              "horizontalAlign": "left"
            },
            "atoms": [
              {
                "id": "y-04l5NF",
                "type": "image",
                "src": "img/system/logos/logo-white.png",
                "link": "https://example.com",
                "alt": "Some alt",
                "width": 110,
                "spacing": {
                  "margin": [
                    0,
                    0,
                    0,
                    0
                  ],
                  "padding": [
                    0,
                    0,
                    0,
                    0
                  ]
                }
              }
            ],
            "rows": []
          },
          {
            "id": "2MWL4PEV",
            "settings": {
              "spacing": {},
              "backgroundColor": "transparent",
              "verticalAlign": "middle",
              "horizontalAlign": "right"
            },
            "atoms": [
              {
                "id": "thDwOtuQ",
                "type": "menu",
                "itemType": "text",
                "gap": 10,
                "items": [
                  {
                    "type": "text",
                    "text": "Specs",
                    "link": "https://example",
                    "color": "#FFFFFF",
                    "fontSize": 16
                  },
                  {
                    "type": "text",
                    "text": "Feature",
                    "link": "https://example",
                    "color": "#FFFFFF",
                    "fontSize": 16
                  },
                  {
                    "type": "text",
                    "text": "Price",
                    "link": "https://example",
                    "color": "#FFFFFF",
                    "fontSize": 16
                  }
                ],
                "spacing": {
                  "margin": [
                    0,
                    0,
                    0,
                    0
                  ],
                  "padding": [
                    0,
                    0,
                    0,
                    0
                  ]
                }
              }
            ],
            "rows": []
          }
        ]
      }
    ]
  }
}
