{
  "version": 2,
  "name": "feature1",
  "label": "Feature 1",
  "type": "feature",
  "preview": "img/components/feature-1.png",
  "block": {
    "id": "HLhHOciq",
    "label": "Feature 1",
    "settings": {
      "spacing": {
        "padding": [
          34,
          32,
          34,
          32
        ]
      },
      "backgroundColor": "#FFFFFF"
    },
    "rows": [
      {
        "id": "fo93eHkQ",
        "settings": {
          "spacing": {},
          "backgroundColor": "transparent",
          "hiddenOnMobile": false,
          "collapseOnMobile": true,
          "gap": 0
        },
        "cells": [
          {
            "id": "7iIWkqzG",
            "settings": {
              "spacing": {},
              "backgroundColor": "transparent",
              "verticalAlign": "top",
              "horizontalAlign": "center"
            },
            "atoms": [
              {
                "id": "fVWhVxNR",
                "type": "text",
                "value": "<p style=\"text-align:center\"><strong><span style=\"color:#FF6B00;font-size:13px\">THREE USEFUL OUTCOMES</span></strong></p><p style=\"text-align:center\"><strong><span style=\"font-size:31px\">A system that earns its place.</span></strong></p>",
                "color": "#1F1712",
                "spacing": {
                  "padding": [
                    0,
                    0,
                    0,
                    0
                  ],
                  "margin": [
                    0,
                    0,
                    0,
                    0
                  ]
                }
              }
            ],
            "rows": []
          }
        ]
      },
      {
        "id": "VSkVlALD",
        "settings": {
          "spacing": {
            "padding": [
              20,
              0,
              0,
              0
            ]
          },
          "backgroundColor": "transparent",
          "hiddenOnMobile": false,
          "collapseOnMobile": true,
          "gap": 14
        },
        "cells": [
          {
            "id": "-Shr1JdF",
            "settings": {
              "spacing": {
                "padding": [
                  22,
                  18,
                  22,
                  18
                ]
              },
              "backgroundColor": "#FFF3E6",
              "verticalAlign": "top",
              "horizontalAlign": "left",
              "borderRadius": 16,
              "width": 33
            },
            "atoms": [
              {
                "id": "trwygxB6",
                "type": "text",
                "value": "<p><strong><span style=\"color:#FF6B00;font-size:13px\">FAST</span></strong></p><p><strong><span style=\"font-size:23px\">Start with structure.</span></strong></p><p><span style=\"color:#7A6558;font-size:14px\">Move from blank page to a useful first draft without rebuilding the basics.</span></p>",
                "color": "#1F1712",
                "spacing": {
                  "padding": [
                    0,
                    0,
                    0,
                    0
                  ],
                  "margin": [
                    0,
                    0,
                    0,
                    0
                  ]
                }
              }
            ],
            "rows": []
          },
          {
            "id": "aEax8H6H",
            "settings": {
              "spacing": {
                "padding": [
                  22,
                  18,
                  22,
                  18
                ]
              },
              "backgroundColor": "#FFD9B8",
              "verticalAlign": "top",
              "horizontalAlign": "left",
              "borderRadius": 16,
              "width": 33
            },
            "atoms": [
              {
                "id": "3u9tdgZQ",
                "type": "text",
                "value": "<p><strong><span style=\"color:#5A2B0A;font-size:13px\">CLEAR</span></strong></p><p><strong><span style=\"font-size:23px\">Edit with intent.</span></strong></p><p><span style=\"color:#5A2B0A;font-size:14px\">Keep hierarchy visible while content, media and actions continue to change.</span></p>",
                "color": "#1F1712",
                "spacing": {
                  "padding": [
                    0,
                    0,
                    0,
                    0
                  ],
                  "margin": [
                    0,
                    0,
                    0,
                    0
                  ]
                }
              }
            ],
            "rows": []
          },
          {
            "id": "kheJU0Zf",
            "settings": {
              "spacing": {
                "padding": [
                  22,
                  18,
                  22,
                  18
                ]
              },
              "backgroundColor": "#FFF3E6",
              "verticalAlign": "top",
              "horizontalAlign": "left",
              "borderRadius": 16,
              "width": 33
            },
            "atoms": [
              {
                "id": "wNEQeATe",
                "type": "text",
                "value": "<p><strong><span style=\"color:#FF6B00;font-size:13px\">SAFE</span></strong></p><p><strong><span style=\"font-size:23px\">Send predictably.</span></strong></p><p><span style=\"color:#7A6558;font-size:14px\">Reuse email-safe patterns instead of discovering layout limits at export time.</span></p>",
                "color": "#1F1712",
                "spacing": {
                  "padding": [
                    0,
                    0,
                    0,
                    0
                  ],
                  "margin": [
                    0,
                    0,
                    0,
                    0
                  ]
                }
              }
            ],
            "rows": []
          }
        ]
      }
    ]
  }
}
