{
  "version": 2,
  "name": "header6",
  "label": "Header 6",
  "type": "header",
  "preview": "img/components/header-6.png",
  "block": {
    "id": "-M_20RSW",
    "label": "Header 6",
    "settings": {
      "spacing": {
        "padding": [
          28,
          30,
          0,
          30
        ]
      },
      "backgroundColor": "#FF6B00",
      "backgroundImage": {
        "url": "img/catalog/backgrounds/gradient-orbs.png",
        "repeat": "no-repeat",
        "size": "unset",
        "position": "bottom"
      }
    },
    "rows": [
      {
        "id": "PolQCZef",
        "settings": {
          "spacing": {},
          "backgroundColor": "transparent",
          "hiddenOnMobile": false,
          "collapseOnMobile": true,
          "gap": 16
        },
        "cells": [
          {
            "id": "pRxJ4Few",
            "settings": {
              "spacing": {
                "padding": [
                  0,
                  8,
                  26,
                  0
                ]
              },
              "backgroundColor": "transparent",
              "verticalAlign": "middle",
              "horizontalAlign": "left",
              "width": 58
            },
            "atoms": [
              {
                "id": "CzYxqrlH",
                "type": "text",
                "value": "<div style=\"color:#1F1712\"><p><strong><span style=\"color:#5A2B0A;font-size:13px\">LIVE DEMO / THURSDAY</span></strong></p><p><strong><span style=\"font-size:36px\">Hear the difference before we name it.</span></strong></p><p><span style=\"color:#5A2B0A;font-size:15px\">The presenter demonstrates the product and points attention toward the launch message.</span></p></div>",
                "spacing": {
                  "padding": [
                    0,
                    0,
                    0,
                    0
                  ],
                  "margin": [
                    0,
                    0,
                    0,
                    0
                  ]
                }
              },
              {
                "id": "FuuSpqrJ",
                "type": "button",
                "text": "Reserve a place",
                "link": "https://card.email/start",
                "backgroundColor": "#1F1712",
                "color": "#FFFFFF",
                "fontSize": 15,
                "borderRadius": 10,
                "padding": [
                  13,
                  20,
                  13,
                  20
                ],
                "spacing": {
                  "padding": [
                    13,
                    20,
                    13,
                    20
                  ],
                  "margin": [
                    18,
                    0,
                    0,
                    0
                  ]
                }
              }
            ],
            "rows": []
          },
          {
            "id": "d5mk868D",
            "settings": {
              "spacing": {},
              "backgroundColor": "transparent",
              "verticalAlign": "bottom",
              "horizontalAlign": "center",
              "width": 42
            },
            "atoms": [
              {
                "id": "LA_0qSkx",
                "type": "image",
                "src": "img/catalog/presenters/speaker-presenter.png",
                "link": "https://card.email/start",
                "alt": "Presenter demonstrating an orange wireless speaker",
                "spacing": {
                  "padding": [
                    0,
                    0,
                    0,
                    0
                  ],
                  "margin": [
                    0,
                    0,
                    -3,
                    0
                  ]
                }
              }
            ],
            "rows": []
          }
        ]
      }
    ]
  }
}
