{
  "version": 2,
  "name": "header2",
  "label": "Header 2",
  "type": "header",
  "preview": "img/components/header-2.png",
  "block": {
    "id": "uUuCemff",
    "label": "Header 2",
    "settings": {
      "spacing": {
        "padding": [
          38,
          34,
          38,
          34
        ]
      },
      "backgroundColor": "#FFF9F3"
    },
    "rows": [
      {
        "id": "6EaleFeR",
        "settings": {
          "spacing": {},
          "backgroundColor": "transparent",
          "hiddenOnMobile": false,
          "collapseOnMobile": true,
          "gap": 24
        },
        "cells": [
          {
            "id": "xhMJGIrB",
            "settings": {
              "spacing": {},
              "backgroundColor": "transparent",
              "verticalAlign": "middle",
              "horizontalAlign": "left",
              "width": 56
            },
            "atoms": [
              {
                "id": "3Hij89zy",
                "type": "text",
                "value": "<p><strong><span style=\"color:#FF6B00;font-size:13px\">ROOM-FILLING SOUND</span></strong></p><p><strong><span style=\"font-size:37px\">Small speaker. Serious presence.</span></strong></p><p><span style=\"color:#7A6558;font-size:15px\">A classic media-right hero for a focused product launch.</span></p>",
                "color": "#1F1712",
                "spacing": {
                  "padding": [
                    0,
                    0,
                    0,
                    0
                  ],
                  "margin": [
                    0,
                    0,
                    0,
                    0
                  ]
                }
              },
              {
                "id": "en1yAtxk",
                "type": "button",
                "text": "Meet the speaker",
                "link": "https://card.email/start",
                "backgroundColor": "#FF6B00",
                "color": "#FFFFFF",
                "fontSize": 15,
                "borderRadius": 10,
                "padding": [
                  13,
                  20,
                  13,
                  20
                ],
                "spacing": {
                  "padding": [
                    13,
                    20,
                    13,
                    20
                  ],
                  "margin": [
                    18,
                    0,
                    0,
                    0
                  ]
                }
              }
            ],
            "rows": []
          },
          {
            "id": "LvQoP4jg",
            "settings": {
              "spacing": {
                "padding": [
                  24,
                  16,
                  24,
                  16
                ]
              },
              "backgroundColor": "#FFD9B8",
              "verticalAlign": "middle",
              "horizontalAlign": "center",
              "borderRadius": 20,
              "width": 44
            },
            "atoms": [
              {
                "id": "E1acDCTp",
                "type": "image",
                "src": "img/catalog/products/wireless-speaker.png",
                "link": "https://card.email/start",
                "alt": "Orange wireless speaker",
                "width": 240,
                "spacing": {
                  "padding": [
                    0,
                    0,
                    0,
                    0
                  ],
                  "margin": [
                    0,
                    0,
                    0,
                    0
                  ]
                }
              }
            ],
            "rows": []
          }
        ]
      }
    ]
  }
}
